"Priyanka, Pattabhi",💡 Submit a New AI Idea,"Priyanka, Pattabhi",Accts Payable - VAR,"""APQC""-""Utility Accounts backfilling Reconcilation""-Audit Automation","The current quality control validation process for utility account back-filling relies entirely on manual parameter checks, resulting in significant time investment and operational inefficiency",19 hrs/month,"Implement an AI-powered automation system to eliminate manual validation steps in the CVAM utility site backfilling process. The solution will leverage artificial intelligence and machine learning technologies to:
Automated Data Processing:

Extract account information from T-SIM tickets and source documents using natural language processing
Parse and validate utility site data against CVAM QC parameters automatically
Cross-reference new accounts with existing database records to prevent duplicates",320 per month,,,"[""Time Saved""]",,I have started working on it - in progress,Yes – but access approval is required,,2–3 months,Not sure,,,,,,,,,,,,,,,,,,,,,,,,4/15/2026 8:31,4/13/2026 22:07,"Begari, Praveen Kumar",,,,"Begari, Praveen Kumar",3,Pending,"New critical vendor accounts must be manually backfilled into the CVAM dashboard to ensure comprehensive payment monitoring coverage for all critical accounts. The process begins when the Vendor Maintenance team completes the creation of a new supplier or site. Following this completion, a T-SIM ticket is automatically assigned to the Critical Vendors team CTI for processing.
The Critical Vendor (CV) user is responsible for executing the backfill activity. This involves manually entering the new account information into the CVAM dashboard to establish proper payment monitoring protocols. Once the backfill is completed, the Quality Control (QC) team performs a thorough audit of the back-filled utility accounts based on predefined parameters to ensure data accuracy and completeness.
This manual process ensures that no critical vendor account is overlooked in the payment monitoring system, maintaining the integrity of vendor payment operations and compliance requirements.",,In Progress (Development Stage)
"Rao, Boda Veerabhadra",💡 Submit a New AI Idea,"Rao, Boda Veerabhadra",Accts Payable - VAR,"""APQC""-""Freight & Miscellaneous""-Audit Automation",Need to eliminate the manual steps of the audit,,With the help of automation tools I want to simplify the current manual process,,,,"[""Time Saved"",""Error Reduction"",""SLA Improvement"",""Cost Reduction"",""Compliance Improvement""]",,I need to start working on it,Yes – I already have access,,2 weeks,Not sure,,,,,,,,,,,,,,,,,,,,,,,,4/15/2026 8:32,4/13/2026 23:59,"Begari, Praveen Kumar",,,,"Begari, Praveen Kumar",3,Pending,APQC team audit the sample transactions of the Ops team,,In Progress (UAT Stage)
"Rao, Boda Veerabhadra",💡 Submit a New AI Idea,"Rao, Boda Veerabhadra",Accts Payable - VAR,"""APQC""-""Early Payments""-Audit Automation",Need to eliminate the manual steps of the audit,,With the help of automation tools I want to simplify the current manual process,,,,"[""Time Saved"",""Error Reduction"",""SLA Improvement"",""Compliance Improvement"",""Cost Reduction""]",,I need to start working on it,Yes – I already have access,,2 weeks,Not sure,,,,,,,,,,,,,,,,,,,,,,,,4/15/2026 8:30,4/14/2026 0:04,"Begari, Praveen Kumar",,,,"Begari, Praveen Kumar",3,Pending,APQC team audit the sample transactions of the Ops team,,In Progress (UAT Stage)
"Rao, Boda Veerabhadra",💡 Submit a New AI Idea,"Rao, Boda Veerabhadra",Accts Payable - VAR,"""APQC""-""Corp AP (NA) P Card (Manual & Auto) Payment""-Audit Automation",Need to eliminate the manual steps of the audit,,With the help of automation tools I want to simplify the current manual process,,,,"[""Time Saved"",""Cost Reduction"",""Error Reduction"",""SLA Improvement"",""Compliance Improvement""]",,I need to start working on it,Yes – I already have access,,2 weeks,Not sure,,,,,,,,,,,,,,,,,,,,,,,,4/15/2026 8:34,4/14/2026 0:11,"Begari, Praveen Kumar",,,,"Begari, Praveen Kumar",3,Pending,APQC team audit the sample transactions of the Ops team,,In Progress (UAT Stage)
"Rao, Boda Veerabhadra",💡 Submit a New AI Idea,"Rao, Boda Veerabhadra",Accts Payable - VAR,"""APQC""-""Freight PO""-Audit Automation",Need to eliminate the manual steps of the audit,,With the help of automation tools I want to simplify the current manual process,,,,"[""Time Saved"",""Cost Reduction"",""Error Reduction"",""Compliance Improvement"",""SLA Improvement""]",,I need to start working on it,Yes – I already have access,,2 weeks,Not sure,,,,,,,,,,,,,,,,,,,,,,,,4/15/2026 8:33,4/14/2026 0:14,"Begari, Praveen Kumar",,,,"Begari, Praveen Kumar",3,Pending,APQC team audit the sample transactions of the Ops team,,In Progress (UAT Stage)
"Rao, Boda Veerabhadra",💡 Submit a New AI Idea,"Rao, Boda Veerabhadra",Accts Payable - VAR,"""APQC""-""SUA Corp Card Payment""-Audit Automation",Need to eliminate the manual steps of the audit,,With the help of automation tools I want to simplify the current manual process,,,,"[""Time Saved"",""Cost Reduction"",""Error Reduction"",""SLA Improvement"",""Compliance Improvement""]",,I need to start working on it,Yes – I already have access,,2 weeks,Not sure,,,,,,,,,,,,,,,,,,,,,,,,4/15/2026 8:32,4/14/2026 0:17,"Begari, Praveen Kumar",,,,"Begari, Praveen Kumar",3,Pending,APQC team audit the sample transactions of the Ops team,,In Progress (UAT Stage)
"Rao, Boda Veerabhadra",💡 Submit a New AI Idea,"Rao, Boda Veerabhadra",Accts Payable - VAR,"""APQC""-""Corp IOH""-Audit Automation",I want to simplify and eliminate the manual steps in the current process,,With the help of AI tools I need to create automated solution for the current process,,,,"[""Time Saved"",""Error Reduction"",""Cost Reduction"",""SLA Improvement"",""Compliance Improvement""]",,I need to start working on it,Yes – I already have access,,2 weeks,Not sure,,,,,,,,,,,,,,,,,,,,,,,,4/16/2026 3:22,4/14/2026 0:24,"Begari, Praveen Kumar",,,,"Begari, Praveen Kumar",3,Pending,APQC team audit the transaction of the Corp IOH process,,In Progress (UAT Stage)
"Thakur, Kavya",💡 Submit a New AI Idea,"Thakur, Kavya",Accts Payable - VAR,"APQC""-""Employee Expense""-Audit Automation","The Accounts Payable Quality Control (APQC) team currently faces significant operational inefficiencies due to manual processes across the expense validation workflow. Daily data extraction from the AppZen tool, policy verification validation, cross-platform receipt validation between Concur and AppZen based on QC parameters, and monthly metrics preparation are all performed manually. ",`230 hrs,"Implement automated API integration between AppZen and Concur to eliminate manual daily data extraction and enable real-time cross-platform receipt validation based on QC parameters. Deploy a rule-based policy verification engine that automatically flags violations and ensures consistent policy application. Build automated dashboards with scheduled reporting to replace manual monthly metrics preparation, enabling the team to focus on exception handling and continuous improvement.
",2520 per month,,,"[""Time Saved""]",,I need to start working on it,Yes – I already have access,v,2–3 months,Not sure,,,,,,,,,,,,,,,,,,,,,,,,4/16/2026 3:21,4/14/2026 0:43,"Begari, Praveen Kumar",,,,"Begari, Praveen Kumar",3,Pending,"In AP Employee Expense QC reviews the accuracy of EE analyst in handling report adhering to the set defined audit parameters, policies and process SOP’s. The goal is to analyze accuracy of EE users.",,In Progress (Development Stage)
"Rao, Boda Veerabhadra",💡 Submit a New AI Idea,"Rao, Boda Veerabhadra",Accts Payable - VAR,Corp IOH,IOH team supports to requester for the hold resolutions,,I want to eliminate the manual steps in the current process.,,,,"[""Time Saved""]",,I need to start working on it,Yes – but access approval is required,,Exploratory,Not sure,,,,,,,,,,,,,,,,,,,,,,,,4/15/2026 8:33,4/14/2026 0:56,"Begari, Praveen Kumar",,,,"Begari, Praveen Kumar",3,Pending,"Amazon Corporate Accounts Payable (Corp AP) department handles the indirect expenses incurred to carry out day-to-day activities of the business globally. These expenses are not a part of the core e-commerce business of Amazon; hence, they are also referred as Non-Retail Expense. Example – Repairs, Rent, Office Supplies, Security, Photographic, Shipping supplies, Packaging expense, Online Advertising Media, Temporary Service Employees, Professional Fees etc. Once the invoice is entered and if there is any discrepancy between invoice and Purchase Order then invoices goes on manual/system hold due to various reasons. Following table comprises list of hold, nature and scenario when it is placed on invoices. To provide an overview of the as-is process of the Corp AP invoice cancellation and seek confirmation from Legal, Tax and Accounting on the SOP followed by regional AP teams.",,In Progress (UAT Stage)
"Dubbaka, Prashanth",💡 Submit a New AI Idea,"Dubbaka, Prashanth",Accts Payable - VAR,Key Account Management(KAM) - ARIPL IN,"Reconciling weekly KAM statements is currently a manual process that requires logging into multiple tools including FinOps Central, Dices, Oracle & Hubble queries. This multi-system approach is extremely time-consuming. We are seeking to automate the complete statement reconciliation process through AI automation to eliminate manual effort, reduce processing time, and improve accuracy. The automation would streamline data extraction from all three systems, perform reconciliation logic automatically, and generate reconciled statements ready for vendor sharing on a weekly basis or when ever required.",,"We are seeking to automate the complete statement reconciliation process through AI automation to eliminate manual effort, reduce processing time, and improve accuracy. The automation would streamline data extraction from all three systems, perform reconciliation logic automatically, and generate reconciled statements ready for vendor sharing on a weekly basis or when ever required.",,,,"[""Time Saved""]",,I need to start working on it,Not sure,Yes,2 weeks,Not sure,,,,,,,,,,,,,,,,,,,,,,,No,4/15/2026 8:13,4/14/2026 6:38,"Dash, Bighnaraja",,,,"Vijayakumar, Priyadarsini",1,Pending,"We receive weekly statements from all KAM IN vendors. Based on these statements, the team reconciles the data and shares the reconciled statements with vendors on a weekly basis.",,In Progress (Development Stage)
"Kandukuri, Swapna",🔁 Request to Replicate an Existing AI Win,,,,,,,,,,"[""Time Saved""]",,,,,,,ATLAS,"Amazon's Policies require robust controls for invoices submitted by Third Party Intermediaries (TPIs) interacting with Government on Amazon's behalf. The Transaction Testing Team (TTT) under Accounts Payable India reviews high-risk vendor invoices identified by BC&E India, focusing on monitoring financial transactions and identifying anti-bribery and corruption risks through validation of service completion, contract rates, and supporting documents.",,"Protecting INR 20,073,281.53 (USD $2.17 MM) in annual government-related payments and preventing potential fraud losses.","•	Enhanced fraud detection will identify duplicate claims early, reduce POC dependency, and strengthen compliance controls while protecting INR 20,073,281.53 (USD $2.17 MM) in annual government-related payments and preventing potential fraud losses.
•	Implementation Scope: Deploy ATLAS for document reading, integrate with Laserfiche and Payee Central, establish fraud detection rules. 2) Implement duplicate detection and licenses/BOE/NOC validation etc. 3) Train AI models for government interaction classification, integrate GDA Dashboard. 
",,,,,,,,,,,Accts Payable NonInventory-VAR,Transaction Testing Team,,,"Kandukuri, Swapna","Kandukuri, Swapna","1.	Coverage: 100% identification of vendors with government interactions
2.	Fraud Detection: Identify and prevent 100% of duplicate proof of completion submissions
3.	Accuracy: 98%+ accuracy in government interaction classification
",,4/15/2026 2:07,4/15/2026 0:07,"Srikanth, Kanumarlapudi",,,,"Srikanth, Kanumarlapudi",3,Pending,,"TTT identifies government-interaction vendors through BC&E due diligence reports and business unit confirmations. How-ever, limited POC visibility into service confirmations has created difficulties and extended timelines in obtaining compre-hensive vendor lists. Additionally, manual review processes have revealed instances where vendors submit the same proof of completion documents for multiple different invoice numbers, indicating potential fraudulent activity or duplicate bill-ing that currently goes undetected at scale. TTT seeks AI automation support to ensure 100% coverage of vendors engaging in high-risk government interaction payments while simultaneously detecting and preventing such duplicate proof of completion submissions.",In Progress (Development Stage)
"JADHAV, RAMANAND",💡 Submit a New AI Idea,"JADHAV, RAMANAND",Accts Payable NonInventory-VAR,APQC,"The current process of tracking and following up with managers, trainers, and L6 managers for required information involves significant manual effort. Our objective is to implement automation to streamline these follow-ups.",200 hrs,"An automated follow-up system can be configured to manage these recurring touchpoints with managers, trainers, and L6 managers.",550 sims per year,,,"[""Time Saved""]",,I need to start working on it,Yes – I already have access,,2 weeks,No,,,,,,,,,,,,,,,,,,,,,,,saving of 300 plus hrs,4/16/2026 3:24,4/15/2026 5:10,"Begari, Praveen Kumar",,,,"Begari, Praveen Kumar",2,Pending,"Our weekly workflow begins every Tuesday with an HR report. After segmenting the data, we initiate SIM tickets for newly joined employees and route them to their managers for required details. We maintain regular follow-ups across three levels: direct managers, trainers, and L6 managers to secure final approval.
",,In Progress (UAT Stage)
"Mohammed, Abdul Rahaman",💡 Submit a New AI Idea,"Mohammed, Abdul Rahaman",Accts Payable NonInventory-VAR,Expense FinCoM,"Current Challenges

The quality assessment process requires auditors to manually verify:
1. First Time Right (FTR) Response: Analysts must address employee queries correctly on the first attempt, incorporating six essential communication elements—paraphrasing, acknowledgement, empathy/apology statements, appreciation, assurance, and action. Manual verification of these components across 150 tickets is labor-intensive and prone to inconsistency.

2. SLA Adherence: Monitoring compliance with 24-hour response times for assigned tickets and 48-hour timelines for pending tickets requires meticulous tracking and documentation.

3. Ticket Closure Quality: Ensuring proper resolution with clear explanations and Chime connect verification demands thorough manual review of each interaction.

4. Blurb Usage Compliance: Validating appropriate use of approved response templates across all tickets adds another layer of manual verification.

5. Transfer Accuracy: Confirming correct ticket routing to appropriate CTI teams (LATAM/PEK/MNL) requires knowledge of proper escalation protocols and manual validation.
",38 hours per month,"To address the inefficiencies of manual Internal Quality Checks, we propose developing an AI-powered agent that automates the auditing process for SIM tickets. This intelligent system will function as a virtual auditor, systematically evaluating approximately 150 ticket samples monthly against established quality parameters and delivering instant defect classifications.

The AI agent will autonomously perform comprehensive quality assessments by:

Automated FTR Analysis: The agent will analyze ticket responses using natural language processing to detect the presence and quality of all six communication elements—paraphrasing, acknowledgement, empathy statements, apology, appreciation, assurance, and action. It will flag tickets missing any component or demonstrating poor execution.

SLA Compliance Monitoring: The system will automatically track response timestamps, calculate elapsed time, and identify SLA violations for both assigned tickets (24-hour threshold) and pending tickets (48-hour threshold), eliminating manual time calculations.

Resolution Quality Assessment: The agent will evaluate ticket closure quality by verifying clear resolution statements and confirming Chime connect completion, ensuring employees receive proper support.

Blurb Validation: Using pattern matching and approved template databases, the AI will verify correct usage of standardized response blurbs and identify unauthorized or improper variations.

Transfer Accuracy Verification: The system will validate ticket routing decisions by comparing transfer destinations against established CTI assignment rules for LATAM, CN, and MNL teams.

For each reviewed ticket, the agent will generate a binary classification (defect/no defect) with detailed justification, enabling rapid feedback to analysts while freeing auditors to focus on strategic quality improvements and complex cases requiring human judgment.",150 tickets per month,,,"[""Time Saved""]",,I have started working on it - in progress,Yes – I already have access,,1 month,Yes,,,,,,,,,,,,,,,,,,,,,,,,4/28/2026 3:53,4/16/2026 3:16,"Manchili, Sree Somasekhar",,,,"Manchili, Sree Somasekhar",3,Pending,"The Expense FinCoM team (EFT) currently conducts manual Internal Quality Checks (IQC) and Negative Response Rate (NRR) Tickets on approximately 150 SIM ticket samples monthly, creating a time-intensive and resource-draining process for auditors. This manual review evaluates analyst performance across five critical parameters but lacks efficiency and scalability.",,In Progress (Development Stage)
"K, Prathima",🏆 Submit a Completed AI Win,,,,,,,,,,"[""Time Saved""]",,,,,,,,,,,,,Project Athena — Call Audit AI,"K, Prathima","K, Prathima",,,"With ~2,700 vendor support calls generated monthly across 4 regions (NA, EU, APAC, India), only 2–3% (50–80 calls) can be manually audited due to resource constraints. Each manual audit takes 25–30 minutes against an 11-parameter quality rubric. This sample-based approach misses systemic quality issues, delays agent feedback, creates inconsistent coverage, and limits the team's ability to track performance trends across the full call volume.","Project Athena automatically reviews 100% of call transcripts against the same 11-parameter rubric used by human auditors. The system produces scored audits with detailed findings, coaching recommendations, and evidence quotes within 60 seconds per call. A built-in learning mechanism incorporates auditor corrections to improve accuracy over time. Automated email feedback is delivered to agents and supervisors, and a metrics dashboard provides manager-level insights on team performance, parameter-wise weaknesses, and coaching opportunities.","- Coverage: 3% → 100% of monthly calls audited (54× more)
- Time per audit: 25 mins → 60 - 90 seconds (25× faster)
- Auditor time reclaimed: 25+ hours/month
- Consistency: Eliminates inter-auditor variance (deterministic scoring)
- Faster agent feedback = quicker performance improvement
- Current AI accuracy: 82% first run (92% current); targeting 99% with continuous learning","Yes, with minor customization",,,Accts Payable NonInventory-VAR,"Vendor Call Quality Audits — Corp Fincom & Corp CV across NA, EU, APAC, India regions",,,,,4/21/2026 6:20,4/16/2026 4:23,"THAMMALA, HARI",,,,"THAMMALA, HARI",3,Pending,,,Completed (Awaiting Approvals)
"Sri Ramula, Prashanth",💡 Submit a New AI Idea,"Sri Ramula, Prashanth",Accts Payable NonInventory-VAR,Corporate cards,"Due to a current technical issue in the Amazon learn tool, employees are unable to complete their training for second card applications after first card application training completion. If employee would like to complete training for second card application, it will be show as training has been already completed. As a temporary workaround, we must follow a manual application process that requires L6 manager approval and Terms & Conditions document should be signed/acknowledgment for second card application in SIM.",,"Deploy a dedicated AI agent that assists employees with second card application training upon request and resolves completion blockers. create a Card Training Navigator Agent - A conversational AI assistant integrated into Amazon Learn that operates on-demand.

On-Request Activation: The agent should activate only when an employee explicitly requests help with second card training enrollment after completing first card training
",,,,"[""Time Saved"",""Error Reduction"",""Compliance Improvement""]",,I need to start working on it,No – data source needs to be identified,,1 month,No,,,,,,,,,,,,,,,,,,,,,,,,4/20/2026 5:40,4/16/2026 4:53,"Dash, Bighnaraja",,,,"Dash, Bighnaraja",1,Pending,"Amazon provides Corporate Travel and Expense (T&E) and Purchase Card (P) credit cards to its regular blue badge employee to fulfill their business requirements. To apply for a corporate credit card, Blue badge employees from L1-L5 must connect with their L6+ manager to add them to permission group, then complete Corporate Card application training. Employee L6 and above levels can go directly to Amazon Learn, complete training, and request their card without needing additional approvals from managers.",,In Progress (Development Stage)
"Chalkapurkar, Ajay",💡 Submit a New AI Idea,"Chalkapurkar, Ajay",Accts Payable NonInventory-VAR,Corp AP NA SVOT,"The team currently relies on a manual process to validate vendor emails, PayeeCentral cases, and internal SIMT records before adding Payee email IDs to Payee accounts and PayeeCentral accounts. This manual validation process is time-consuming and inefficient.",12 H/M,"Creating a Bulk Edit chat agent to streamline the bulk edit process, resolve hurdles for team members, and enable review and validation for next actions using Quick Suite. ",50 per monht,,,"[""Time Saved"",""Error Reduction"",""SLA Improvement"",""Compliance Improvement""]",,I have started working on it - in progress,Yes – I already have access,Required tech suport to make is fully autoamted with out manual efferts.,2 weeks,Yes,,,,,,,,,,,,,,,,,,,,,,,,4/22/2026 5:51,4/16/2026 5:35,"Ch, Raghunadh",,,,"Ch, Raghunadh",3,Pending,"The ""Bulk Edit Payees"" feature on Payee Central (FinOps Portal) enables the FinCoM team to add or remove ""Buyers"" and ""Payee"" contacts from Supplier accounts. Currently, the team must manually validate vendor emails, PayeeCentral case details, and internal SIMT records to verify all information before adding Payee email IDs to both Payee and PayeeCentral accounts",,In Progress (Development Stage)
"Otwani, Deepak",🔁 Request to Replicate an Existing AI Win,,,,,,,,,,"[""Time Saved""]",,,,,,,Project FinGenie,"We as corporate cards team have an WIKI page published on w.amazon.com. There is a lot of information on this wiki page and it becomes difficult to navigate through the wiki page to search for information hence my proposal is to create an Chat bot which can get the answers to the questions which card holders may have. Our target is to replicate this to 3 wiki pages

1. Corp card wiki page
2. Expense FinCoM wiki page
3. Expense audit wiki page",,Customer experience ,To build a chat bot ,,,,,,,,,,,Accts Payable NonInventory-VAR,Corporate Cards,,,"Otwani, Deepak",hyperdrive,NA,,4/20/2026 5:40,4/16/2026 14:32,"Dash, Bighnaraja",,,,"Dash, Bighnaraja",1,Pending,,"We as corporate cards team have an WIKI page published on w.amazon.com. There is a lot of information on this wiki page and it becomes difficult to navigate through the wiki page to search for information hence my proposal is to create an Chat bot which can get the answers to the questions which card holders may have. Our target is to replicate this to 3 wiki pages

1. Corp card wiki page
2. Expense FinCoM wiki page
3. Expense audit wiki page",In Progress (UAT Stage)
"Praicy, Martina",💡 Submit a New AI Idea,"Praicy, Martina",Accts Payable NonInventory-VAR,Expense FinCoM Team,"This manual approach is time-intensive, inconsistent, and not scalable — consuming significant SME bandwidth that could otherwise be directed toward proactive resolution and process improvement. The lack of automation also introduces subjectivity in delay attribution and root cause identification, reducing the reliability of insights used for operational decisions.",10,"Build an ML-powered Aged Ticket Analysis Tool that automates the end-to-end process of reading, analyzing, and attributing delays across resolved tickets — eliminating manual SME effort and delivering consistent, data-driven insights.",100,,,"[""Time Saved"",""Error Reduction""]",,I need to start working on it,Yes – but access approval is required,NA,,Yes,,,,,,,,,,,,,,,,,,,,,,,,4/28/2026 3:54,4/16/2026 22:19,"Manchili, Sree Somasekhar",,,,"Manchili, Sree Somasekhar",3,Pending," We need to manually investigate highly aged resolved tickets each month to identify root causes and resolution delays. This process requires SMEs to: Manually pull highly aged resolved tickets (30+ days) from the current month
Read through the full ticket overview and description
Review each correspondence entry chronologically
Identify which team or party caused delays in resolution
Determine the root cause of the prolonged resolution time
This manual approach is time-intensive, inconsistent, and not scalable — consuming significant SME bandwidth that could otherwise be directed toward proactive resolution and process improvement. ",,In Progress (Development Stage)
